{
	"$schema": "./game.config.schema.json",
	"server": {
		"port": 5119,
		"host": "127.0.0.1"
	},
	"game": {
		"version": 4.20,
		"map": 1,
		"id": 1
	},
	"testing": {
		"enabled": true,
		"adminCommands": true,
		"noCooldowns": true,
		"noManaCosts": true,
		"noHeroDying": true,
		"noSpellRangeCheck": false,
		"spawnMinionsLine": 5,
		"bringHeroesToLine": true,
		"levelUpPlayers": 6,
		"noAutoGameStart": true,
		"wavesInitialTimeToSpawn": 1,
		"startingGold": 47500
	},
	"debugging": {
		"enabled": true,
		"noTerrainEscape": false,
		"noPathFinding": true,
		"noNavmeshVision": false,
		"noGrassCheck": false,
		"noSpawners": false,
		"chatDebugMessages": true
	},
	"logging": {
		"debug": "console",
		"packet": "websocket"
	},
	"players": [
		{
			"summoner": {
				"id": 1,
				"name": "Player1",
				"level": 30,
				"iconId": 666,
				"rankId": 0,
				"ribbonId": 0,
				"spells": {
					"d": "SummonerHeal",
					"f": "SummonerFlash"
				}
			},
			"match": {
				"team": 100,
				"champion": "Ahri",
				"skin": 0
			},
			"runes": [],
			"talents": []
		},
		{
			"summoner": {
				"id": 2,
				"name": "Player2",
				"level": 30,
				"iconId": 666,
				"rankId": 0,
				"ribbonId": 0,
				"spells": {
					"d": "SummonerSmite",
					"f": "SummonerBoost"
				}
			},
			"match": {
				"team": 200,
				"champion": "Ezreal",
				"skin": 0
			},
			"runes": [],
			"talents": []
		},
		{
			"summoner": {
				"id": 3,
				"name": "Player3",
				"level": 30,
				"iconId": 666,
				"rankId": 0,
				"ribbonId": 0,
				"spells": {
					"d": "SummonerHeal",
					"f": "SummonerFlash"
				}
			},
			"match": {
				"team": 100,
				"champion": "Yasuo",
				"skin": 0
			},
			"runes": [],
			"talents": []
		}
	]
}